{
  "$schema": "https://roblox-top1.local/schemas/object-product-contracts.schema.json",
  "schemaVersion": "1.0.0",
  "authority": {
    "productArtContract": {
      "path": "art/authority/product-art-authority-v1.json",
      "sha256": "217c95da6202e43ad542094bcc2389493748c9d4bc9045e95647de9b6d98e2ca"
    },
    "retentionDoctrine": {
      "path": "docs/PRODUCT_INNOVATION_AND_RETENTION_DOCTRINE.md",
      "sha256": "b1b045849e5540cea71c7a9965f5e16351168b25e50550e5bafea40d832bc5ad"
    }
  },
  "globalRules": {
    "primaryGenerationRule": "GPT Image 2 receives one structural reference state for one object per image; operational overlays and transient reactions never create an unbounded Cartesian product.",
    "stateCompositionRule": "Runtime presentation composes one structural reference state with at most the explicitly applicable operational, interaction and transient layers while preserving identity and gameplay anchors.",
    "truthRule": "A visual cue may never promise passability, collision, targeting, damage, repair, persistence or adaptation unless an accepted gameplay contract binds that consequence.",
    "evidenceBoundary": "These bindings express falsifiable design intent only; retention, readability, implementation and runtime behavior remain unproven until their named human and technical gates pass."
  },
  "assets": {
    "barricade": {
      "retentionBinding": {
        "primaryHypothesis": {
          "id": "H-FAILURE-001",
          "status": "TESTING",
          "priority": "P0a",
          "designContribution": "Localized structural failure should let a player identify which lane-control assumption weakened without dictating the exact repair.",
          "intendedPlayerBehavior": "After the assault, the player points to the failed bay, changes placement or protection, and voluntarily tests the revised route hypothesis.",
          "recognitionTest": "On the weakest supported mobile view, the player identifies intact, damaged and critical states plus the failed bay without relying on color.",
          "decisionMetric": "A non-briefed player attributes the first breach to the correct barricade region and proposes a coherent preparation change without assistance.",
          "failureCondition": "The state looks decorative, suggests a false traversable passage, hides the repair side, or fails to produce a coherent next preparation decision.",
          "guardrails": [
            "No permanent visual loss may erase player ownership after the assault reset.",
            "No warning cue may claim a collision or pathing consequence that does not exist.",
            "Repair guidance may expose the weak region but may not prescribe one mandatory solution."
          ],
          "gate": "G3",
          "claimBoundary": "The barricade supports the current failure-learning experiment; it does not prove retention, persistent history or a living-fortress system."
        },
        "secondaryHypotheses": [
          {
            "id": "H-FORTRESS-001",
            "status": "DEFERRED",
            "scope": "A bounded replacement panel may suggest authored maintenance as a visual motif.",
            "implementationAllowed": false,
            "claimBoundary": "The repair motif is visual narrative only and must not imply persistent repair history before the living-fortress gate opens."
          }
        ],
        "evidenceStatus": "UNPROVEN"
      },
      "runtimeStateModel": {
        "primaryGenerationStates": ["intact", "damaged", "critical"],
        "compositionRule": "Choose exactly one structural state, then add only a compatible placement, selection, targeting or repair overlay without changing frame, feet, bays, collision authority or orientation.",
        "operationalOverlays": [
          {
            "id": "placement_preview",
            "applicability": "Build phase before authoritative placement.",
            "visualCues": ["bounded footprint preview", "valid or invalid placement outline independent of damage color"],
            "geometryPolicy": "Reuse the intact reference geometry with no invented construction stage.",
            "gameplayTruth": "Validity must come from the authoritative placement result, never from image inference."
          },
          {
            "id": "selected_or_targeted",
            "applicability": "Player selection or enemy targeting while placed.",
            "visualCues": ["external outline or ground marker", "no change to structural damage state"],
            "geometryPolicy": "Overlay only; never generate another barricade mesh.",
            "gameplayTruth": "The overlay identifies current UI or threat focus and carries no collision change."
          },
          {
            "id": "repairing",
            "applicability": "An accepted repair action is actively progressing.",
            "visualCues": ["safe-side service pulse", "causal joint closes in declared load order"],
            "geometryPolicy": "Use the declared damaged-to-intact transition and stable component anchors.",
            "gameplayTruth": "Progress, cost and interruption remain owned by the future accepted repair contract."
          }
        ],
        "transientStates": [
          {
            "id": "impact_reaction",
            "applicability": "A validated hit reaches the barricade.",
            "visualCues": ["brief directional recoil", "short non-occluding contact dust"],
            "geometryPolicy": "Return to the current structural state after the bounded reaction.",
            "gameplayTruth": "The reaction direction must use the real hit vector and may not invent damage."
          }
        ],
        "terminalState": {
          "id": "destroyed",
          "derivedFrom": "critical",
          "description": "A runtime collapse resolves the blocker only when an accepted pathing and collision contract authorizes destruction.",
          "generationPolicy": "RUNTIME_ONLY_NOT_PRIMARY_GPT_IMAGE_TASK",
          "visualCues": ["outer identity remains attributable during collapse", "route opening appears only with matching collision and navigation change"],
          "gameplayTruth": "Destroyed passability is unresolved under PD-06 and PD-07 and may not be advertised by the critical reference image."
        },
        "coverageBoundary": "The three GPT Image 2 tasks define structural integrity references only; they do not independently generate placement, targeting, repair, impact or destroyed runtime layers."
      },
      "stateTruth": {
        "intact": {
          "status": "CANDIDATE_REQUIRES_GAMEPLAY_CONTRACT",
          "contractRef": "PD-07",
          "trigger": "Candidate full-integrity band selected by the authoritative defense state.",
          "capabilityEffect": "Visually promises the full intended lane-blocking role, subject to the accepted defense contract.",
          "collisionEffect": "The simple wrapper collision remains the sole physical blocking authority.",
          "visualClaim": "Three closed bays, continuous frame and ready rear service module communicate credible temporary protection.",
          "claimBoundary": "The image may show readiness but may not claim durability values, repair cost, energy use or pathing behavior."
        },
        "damaged": {
          "status": "CANDIDATE_REQUIRES_GAMEPLAY_CONTRACT",
          "contractRef": "PD-07",
          "trigger": "Candidate intermediate integrity band after a validated causal hit.",
          "capabilityEffect": "Shows reduced structural confidence without creating a traversable opening or asserting an unapproved stat penalty.",
          "collisionEffect": "Wrapper footprint and blocking remain unchanged in this reference state.",
          "visualClaim": "Exactly one bay loses alignment while frame, feet, rear access and object identity remain usable.",
          "claimBoundary": "The visual exposes a repair target but does not promise that repair is implemented or mechanically optimal."
        },
        "critical": {
          "status": "CANDIDATE_REQUIRES_GAMEPLAY_CONTRACT",
          "contractRef": "PD-07",
          "trigger": "Candidate final pre-destruction integrity band after the same causal failure widens.",
          "capabilityEffect": "Communicates imminent structural failure while preserving the current blocker until a separate destroyed transition is authorized.",
          "collisionEffect": "No passable gap exists in the critical reference; wrapper collision and navigation remain unchanged.",
          "visualClaim": "One dominant non-passable vulnerability opening, exposed load path and open rear service system create urgent but honest failure.",
          "claimBoundary": "A traversable breach may appear only in the runtime destroyed state with matching authoritative collision and route updates."
        }
      },
      "promptDiscipline": {
        "subjectClass": "modular_defense",
        "identityLockRules": [
          "Freeze one exact three-bay frame, two-foot footprint, brace direction and rear service module before rendering every quadrant.",
          "The enemy-facing side carries impact structure; the player-facing rear carries the only friendly interaction socket.",
          "Critical damage may expose a large weakness but never a visually traversable passage in the primary reference."
        ],
        "styleRules": [
          "Use calm thick standardized rails, large reclaimed panels and one mechanically justified copper-bounded replacement.",
          "Salvaged Frontier reads through intelligent repair and compatible modules, not random scrap, dirt or decorative diagonal stripes.",
          "Keep broad mobile-readable masses and a strict primary-secondary-tertiary hierarchy."
        ],
        "negativeRules": [
          "No fourth bay, missing foot, floating panel, front interaction control or unsupported brace.",
          "No open human-sized passage in intact, damaged or critical primary references.",